<?xml version="1.0"  encoding="UTF-8"?>
<Level-03_Ground_Image_Processing_Parameter xmlns:xsi="http://www.w3.org/2001/XMLSchema-instance" xsi:noNamespaceSchemaLocation="L3_GIPP.xsd">
  <Common_Section>
    <Log_Level>DEBUG</Log_Level>
    <!-- NOTSET, DEBUG, INFO, WARNING, ERROR, CRITICAL -->
    <DN_Scale>4000</DN_Scale>
    <UP_Scheme_1C>S2_User_Product_Level-1C_Metadata.xsd</UP_Scheme_1C>
    <UP_Scheme_2A>S2_User_Product_Level-2A_Metadata.xsd</UP_Scheme_2A>
    <UP_Scheme_3>S2_User_Product_Level-3_Metadata.xsd</UP_Scheme_3>
    <Tile_Scheme_1C>S2_PDI_Level-1C_Tile_Metadata.xsd</Tile_Scheme_1C>
    <Tile_Scheme_2A>S2_PDI_Level-2A_Tile_Metadata.xsd</Tile_Scheme_2A>
    <Tile_Scheme_3>S2_PDI_Level-3_Tile_Metadata.xsd</Tile_Scheme_3>
    <DS_Scheme_1C>S2_PDI_Level-1C_Datastrip_Metadata.xsd</DS_Scheme_1C>
    <DS_Scheme_2A>S2_PDI_Level-2A_Datastrip_Metadata.xsd</DS_Scheme_2A>
    <DS_Scheme_3>S2_PDI_Level-3_Datastrip_Metadata.xsd</DS_Scheme_3>
    <GIPP_Scheme>L3_GIPP.xsd</GIPP_Scheme>
  </Common_Section>
  <L3_Synthesis>
    <Min_Time>2014-01-01T00:00:00Z</Min_Time>
    <Max_Time>2014-12-31T23:59:59Z</Max_Time>
    <Priority>RADIOMETRIC_QUALITY</Priority>
    <!-- MOST_RECENT, TEMP_HOMOGENEITY, RADIOMETRIC_QUALITY -->
    <Algorithm>ONE_PASS</Algorithm>
    <!-- ONE_PASS, TWO_PASS -->
    <Cirrus_Removal>true</Cirrus_Removal>
    <Shadow_Removal>true</Shadow_Removal>
    <Snow_Removal>true</Snow_Removal>
    <Max_Tiles_Processed>5</Max_Tiles_Processed>
    <Max_Cloud_Probability>30</Max_Cloud_Probability>
    <Max_Invalid_Pixels_Percentage>2</Max_Invalid_Pixels_Percentage>
    <Max_Aerosol_Optical_Thickness>45</Max_Aerosol_Optical_Thickness>
    <Max_Solar_Zenith_Angle>60</Max_Solar_Zenith_Angle>
    <Max_Viewing_Angle>30</Max_Viewing_Angle>
  </L3_Synthesis>
  <Classificators>
    <NO_DATA>0</NO_DATA>
    <SATURATED_DEFECTIVE>1</SATURATED_DEFECTIVE>
    <DARK_FEATURES>2</DARK_FEATURES>
    <CLOUD_SHADOWS>3</CLOUD_SHADOWS>
    <VEGETATION>4</VEGETATION>
    <BARE_SOILS>5</BARE_SOILS>
    <WATER>6</WATER>
    <LOW_PROBA_CLOUDS>7</LOW_PROBA_CLOUDS>
    <MEDIUM_PROBA_CLOUDS>8</MEDIUM_PROBA_CLOUDS>
    <HIGH_PROBA_CLOUDS>9</HIGH_PROBA_CLOUDS>
    <THIN_CIRRUS>10</THIN_CIRRUS>
    <SNOW_ICE>11</SNOW_ICE>
    <URBAN_AREAS>12</URBAN_AREAS>
  </Classificators>
</Level-03_Ground_Image_Processing_Parameter>
